LANGUAGE,English,French,Italian,Spanish,German,Comment,,,,,
STRC_01,,

STRCN_00,Training,Training,Training,Training,Training, Name of the mission
STRM_Reastdead1,"ALPHA BLACK TO PAPA BEAR. AMMO DUMP DESTROYED. OVER.",alpha
STRM_Reastdead2,"ALPHA TO PAPA BEAR. AMMO DEPOT CLEARED. OVER.",alpha

STRM_Rhqreply1,"PAPA BEAR TO ALPHA BLACK. OK PROCEED WITH CAUTION. OVER.",hq
STRM_Rhqreply2,"PAPA BEAR TO ALPHA. EXCELLENT JOB. STAND BY FOR FURTHER INSTRUCTIONS. OVER.",hq

STRD_Rmissname,"PMC Ranger Ammos",missionname
STRL_Rload,"In the forest...",loadname
