LANGUAGE,English,French,Italian,Spanish,German,Comment,,,,,
STRC_01,,

STRCN_00,Training,Training,Training,Training,Training, Name of the mission
STRM_Reastdead1,"Papa Bear, this is Alpha leader. We've cleared the area around the houses. Over.",alpha
STRM_Reastdead2,"Alpha Black to Papa Bear. Johan's Farm is neutralized. Over.",alpha
STRM_Reastdead3,"Papa Bear, this is Alpha Black. Maarn is ours. Third objective complete. Over.",alpha
STRM_Reastdead4,"Alpha Black to Papa Bear. Camerig has fallen. Over.",alpha

STRM_Rhqreply1,"Roger that, Alpha. Objective One clear. Affirmative. Papa Bear out.",hq
STRM_Rhqreply2,"Understood, Alpha. Good work. Objective Two complete. Out.",hq
STRM_Rhqreply3,"Papa Bear to Alpha Black. We copy you Alpha. Out.",hq
STRM_Rhqreply4,"Acknowledged, Alpha Black. Nice work.",hq
STRM_Rmcomplete,"Alpha team, your mission is accomplished. Papa Bear signing off. Out.",hq

STRD_Rmissname,"Silver Bullets",missionname/H29
STRL_Rload,"Ruby, M1A1 Tank, at Bergh.",loadname

start marker name string
STR_START,Start

target marker name strings
STR_TARGET1,Capture houses
STR_TARGET2,Capture Johan's Farm
STR_TARGET3,Capture Maarn
STR_TARGET4,Capture Camerig
